{
  "schema_version": "1.0.0",
  "dataset_id": "open-interest-clusters-global",
  "dataset_version": "2026-04-19",
  "locale_default": "en",
  "normalization": {
    "unicode_form": "NFKC",
    "casefold": true,
    "strip_leading_hash_for_storage": true
  },
  "clusters": [
    {
      "id": "technology.apple",
      "status": "active",
      "display": {
        "label": "Apple",
        "short_description": "Apple ecosystem including iPhone, Mac, iPad, software, events, and Apple-related news",
        "category": "Technology",
        "subcategory": "Apple Ecosystem"
      },
      "anchor": {
        "hashtag": "Apple",
        "follow_by_default_if_interest_selected": true
      },
      "follow_behavior": {
        "mode": "anchor_only",
        "allow_user_opt_in_related_hashtags": false,
        "max_auto_follow_hashtags": 1
      },
      "taxonomy": {
        "parent_id": "technology.general",
        "primary_subcategories": [
          "technology.apple.iphone",
          "technology.apple.mac",
          "technology.apple.ipad",
          "technology.apple.software",
          "technology.apple.events",
          "technology.apple.services"
        ],
        "related_cluster_ids": [
          "technology.general",
          "technology.mobile",
          "artificial.intelligence"
        ]
      },
      "hashtags": {
        "anchor": [
          "Apple"
        ],
        "aliases": [
          "AppleInc",
          "AppleNews",
          "AppleEvent",
          "AppleKeynote",
          "AppleFedi",
          "Applesky",
          "Applestr"
        ],
        "adjacent": [
          "iPhone",
          "iOS",
          "iPad",
          "Mac",
          "MacBook",
          "AppleWatch",
          "AppleVisionPro",
          "visionOS",
          "WWDC",
          "AppleIntelligence",
          "Siri",
          "AppleAI",
          "AppleSilicon",
          "MacRumors",
          "AppleLeaks"
        ],
        "excluded": [
          "AppleFruit",
          "AppleRecipes"
        ]
      },
      "keywords": {
        "high_value": [
          "apple inc",
          "iphone",
          "macbook",
          "ios update",
          "wwdc",
          "apple keynote",
          "apple silicon"
        ],
        "secondary": [
          "tim cook keynote",
          "apple ecosystem",
          "macos update",
          "ipad os",
          "apple services",
          "apple event livestream"
        ],
        "negative": [
          "apple pie",
          "apple fruit nutrition",
          "apple orchard"
        ]
      },
      "entities": {
        "brands": [
          {
            "label": "Apple Inc.",
            "wikidata_id": "Q312",
            "dbpedia_resource": "https://dbpedia.org/resource/Apple_Inc."
          }
        ],
        "products": [
          {
            "label": "iPhone",
            "wikidata_id": "Q4845",
            "dbpedia_resource": "https://dbpedia.org/resource/IPhone"
          }
        ],
        "people_or_orgs": [
          {
            "label": "Tim Cook",
            "wikidata_id": "Q265852",
            "dbpedia_resource": "https://dbpedia.org/resource/Tim_Cook"
          }
        ]
      },
      "multilingual": {
        "language_variants": {
          "en": {
            "hashtags": [
              "Apple",
              "iPhone"
            ],
            "keywords": [
              "apple keynote",
              "ios update"
            ]
          },
          "es": {
            "keywords": [
              "iphone",
              "evento apple"
            ]
          },
          "ja": {
            "keywords": [
              "アップル",
              "iphone"
            ]
          }
        },
        "transliteration_enabled": true,
        "embedding_profile": "multilingual-general-v1"
      },
      "retrieval": {
        "expand_hashtags_for_matching": true,
        "expand_keywords_for_matching": true,
        "expand_entities_for_matching": true,
        "allow_embedding_expansion": true,
        "embedding_only_requires_min_confidence": 0.8
      },
      "ranking_hints": {
        "freshness_half_life_hours": 18,
        "featured_tag_boost": 1.4,
        "pinned_post_keyword_boost": 1.25,
        "profile_bio_keyword_boost": 1.15
      },
      "privacy": {
        "respect_discoverable_false": true,
        "respect_indexable_false": true,
        "exclude_if_profile_or_posts_contain_opt_out_terms": true,
        "opt_out_terms": [
          "NoAI",
          "NoBot",
          "NoBots",
          "NoCrawl",
          "NoCrawling",
          "NoIndex",
          "NoIndexing",
          "NoSearch",
          "NoScrape",
          "NoScraping",
          "NoLLM",
          "NoLLMs",
          "Robotxt"
        ]
      },
      "sources": {
        "curated_by": "memory-core",
        "seed_method": "fediverse-observed + curated",
        "last_reviewed_at": "2026-04-19"
      }
    },
    {
      "id": "gaming.console",
      "status": "active",
      "display": {
        "label": "Gaming",
        "short_description": "Console gaming, game news, publishers, awards, major releases, and gaming culture",
        "category": "Gaming",
        "subcategory": "Console & General Gaming"
      },
      "anchor": {
        "hashtag": "Gaming",
        "follow_by_default_if_interest_selected": true
      },
      "follow_behavior": {
        "mode": "anchor_only",
        "allow_user_opt_in_related_hashtags": false,
        "max_auto_follow_hashtags": 1
      },
      "taxonomy": {
        "parent_id": "gaming.general",
        "primary_subcategories": [
          "gaming.console.playstation",
          "gaming.console.xbox",
          "gaming.console.nintendo",
          "gaming.console.jrpg",
          "gaming.console.indie",
          "gaming.console.publishers"
        ],
        "related_cluster_ids": [
          "gaming.pc",
          "gaming.esports",
          "entertainment.anime",
          "sports.esports"
        ]
      },
      "hashtags": {
        "anchor": [
          "Gaming"
        ],
        "aliases": [
          "GameNews",
          "GamingNews",
          "FediGamer",
          "Gamesky",
          "Gamestr",
          "ConsoleGaming",
          "VideoGames"
        ],
        "adjacent": [
          "PlayStation",
          "PS5",
          "PlayStation5",
          "PS5Pro",
          "PS5Slim",
          "Xbox",
          "XboxSeriesX",
          "XboxSeriesS",
          "Nintendo",
          "Switch",
          "GameInformer",
          "PlaystationBlog",
          "VideoGameAwards",
          "VGA",
          "RPG",
          "JRPG",
          "FPS",
          "IndieGame",
          "IndieGames",
          "Madden",
          "EASports",
          "Hades",
          "Balatro",
          "NBA2K",
          "AnimalCrossing",
          "BattleRoyale",
          "CallOfDuty",
          "Fortnite",
          "SquareEnix",
          "YoshiP"
        ],
        "excluded": [
          "Gamification",
          "MindGames",
          "GameNightBoardGames",
          "HungerGames"
        ]
      },
      "keywords": {
        "high_value": [
          "video game",
          "video games",
          "console gaming",
          "gaming news",
          "game awards",
          "playstation",
          "xbox",
          "nintendo",
          "jrpg",
          "indie game"
        ],
        "secondary": [
          "new game release",
          "gaming showcase",
          "console generation",
          "game trailer",
          "day one patch",
          "digital deluxe",
          "physical edition",
          "frame rate",
          "performance mode",
          "story driven game"
        ],
        "negative": [
          "game theory mathematics",
          "wild game recipe",
          "hunting game season",
          "board game night",
          "gamified learning",
          "mind games relationship"
        ]
      },
      "entities": {
        "brands": [
          {
            "label": "PlayStation",
            "wikidata_id": "Q10683",
            "dbpedia_resource": "https://dbpedia.org/resource/PlayStation"
          }
        ],
        "products": [
          {
            "label": "PlayStation 5",
            "wikidata_id": "Q63184502",
            "dbpedia_resource": "https://dbpedia.org/resource/PlayStation_5",
            "aliases": [
              "PS5",
              "PlayStation5"
            ]
          }
        ],
        "people_or_orgs": [
          {
            "label": "Naoki Yoshida",
            "wikidata_id": "Q11733267",
            "dbpedia_resource": "https://dbpedia.org/resource/Naoki_Yoshida",
            "aliases": [
              "YoshiP"
            ]
          }
        ]
      },
      "multilingual": {
        "language_variants": {
          "en": {
            "hashtags": [
              "Gaming",
              "GameNews",
              "PlayStation",
              "Xbox",
              "JRPG"
            ],
            "keywords": [
              "video games",
              "console gaming",
              "gaming news"
            ]
          },
          "es": {
            "hashtags": [
              "Videojuegos"
            ],
            "keywords": [
              "videojuegos",
              "juegos de consola",
              "noticias de videojuegos"
            ]
          },
          "ja": {
            "keywords": [
              "ゲーム",
              "家庭用ゲーム",
              "ゲームニュース",
              "プレイステーション"
            ]
          }
        },
        "transliteration_enabled": true,
        "embedding_profile": "multilingual-general-v1"
      },
      "retrieval": {
        "expand_hashtags_for_matching": true,
        "expand_keywords_for_matching": true,
        "expand_entities_for_matching": true,
        "allow_embedding_expansion": true,
        "embedding_only_requires_min_confidence": 0.79
      },
      "ranking_hints": {